{
  "apiVersion": "agentic-framework.github.com/v1alpha1",
  "kind": "SecurityRemediationJourneyScenarios",
  "schemaVersion": "1.0.0",
  "contentDigest": "sha256:7b68efe67b07823f5b50e6402ce324215a3dd817f5c43cefc836f0378035938f",
  "spec": {
    "demoProjectId": "security-dependency-remediation",
    "scenarios": [
      {
        "id": "hands-off-to-human-review",
        "input": "Trusted synthetic activation and signed receipts advance intake, five model stages, and deterministic patch planning to Human Review.",
        "expectedAction": "wait-human",
        "expectedState": "HUMAN_REVIEW",
        "inferenceAllowed": true,
        "effectAllowed": true,
        "externalCallCount": 0
      },
      {
        "id": "synthetic-human-to-completed",
        "input": "A separate eligible synthetic human accepts the exact verified current head after the waiting-human checkpoint.",
        "expectedAction": "advance",
        "expectedState": "COMPLETED",
        "inferenceAllowed": false,
        "effectAllowed": false,
        "externalCallCount": 0
      }
    ]
  }
}
